number,value,datetime_start,datetime_complete,duration,params_hgb_class_weight,params_hgb_l2_regularization,params_hgb_learning_rate,params_hgb_max_iter,params_hgb_max_leaf_nodes,params_hgb_min_samples_leaf,params_model_type,params_rf_class_weight,params_rf_max_depth,params_rf_max_features,params_rf_min_samples_leaf,params_rf_min_samples_split,params_rf_n_estimators,user_attrs_accuracy_mean,system_attrs_fixed_params,system_attrs_tpe:relative_params:0,state
0,0.7411150104859532,2026-10-05 10:46:37.921503,2026-10-05 10:46:43.643130,0 days 00:00:05.721627,,,,,,,random_forest,balanced,,sqrt,1.0,2.0,200.0,0.8549710651001977,"{'model_type': 'random_forest', 'rf_n_estimators': 200, 'rf_max_depth': None, 'rf_min_samples_split': 2, 'rf_min_samples_leaf': 1, 'rf_max_features': 'sqrt', 'rf_class_weight': 'balanced'}",,COMPLETE
1,0.7353143728480586,2026-10-05 10:46:43.643927,2026-10-05 10:46:53.726569,0 days 00:00:10.082642,,0.00019517224641449495,0.10790061933340454,600.0,32.0,24.0,hist_gradient_boosting,,,,,,,0.857871057619203,,,COMPLETE
2,0.7367004499196744,2026-10-05 10:46:53.727490,2026-10-05 10:47:07.806368,0 days 00:00:14.078878,,,,,,,random_forest,balanced_subsample,,log2,3.0,6.0,600.0,0.8446227834198344,,,COMPLETE
3,0.7251285879387149,2026-10-05 10:47:07.807134,2026-10-05 10:47:21.970530,0 days 00:00:14.163396,balanced,0.00021147447960615738,0.07824283257099392,200.0,83.0,25.0,hist_gradient_boosting,,,,,,,0.8480721817588747,,,COMPLETE
4,0.7253658372945401,2026-10-05 10:47:21.971598,2026-10-05 10:47:28.685536,0 days 00:00:06.713938,,,,,,,random_forest,balanced,,sqrt,2.0,10.0,200.0,0.8441953826718915,,,COMPLETE
5,0.7351943740629224,2026-10-05 10:47:28.686595,2026-10-05 10:47:41.026743,0 days 00:00:12.340148,,,,,,,random_forest,balanced,,sqrt,2.0,5.0,400.0,,,,PRUNED
6,0.7364722630123534,2026-10-05 10:47:41.027321,2026-10-05 10:47:45.753156,0 days 00:00:04.725835,,,,,,,random_forest,balanced_subsample,16.0,log2,2.0,2.0,200.0,0.8426080475375283,,,COMPLETE
7,0.724550130897181,2026-10-05 10:47:45.753724,2026-10-05 10:47:50.079848,0 days 00:00:04.326124,,,,,,,random_forest,balanced,32.0,sqrt,3.0,8.0,600.0,,,,PRUNED
8,0.7430148638119675,2026-10-05 10:47:50.080586,2026-10-05 10:48:21.680625,0 days 00:00:31.600039,,0.00024260488932164486,0.03550767407304449,400.0,100.0,30.0,hist_gradient_boosting,,,,,,,0.8582984499803805,,,COMPLETE
9,0.7196475701361807,2026-10-05 10:48:21.681852,2026-10-05 10:48:32.854971,0 days 00:00:11.173119,,,,,,,random_forest,balanced,32.0,0.5,5.0,9.0,500.0,,,,PRUNED
10,0.7313373106568516,2026-10-05 10:48:32.856023,2026-10-05 10:48:50.401893,0 days 00:00:17.545870,,3.454013068456222,0.02027809618076176,800.0,120.0,97.0,hist_gradient_boosting,,,,,,,,,"{""model_type"": ""hist_gradient_boosting""}",PRUNED
11,0.7324143238291488,2026-10-05 10:48:50.402907,2026-10-05 10:48:56.391118,0 days 00:00:05.988211,,0.14086064004834029,0.022614977272964288,200.0,18.0,73.0,hist_gradient_boosting,,,,,,,,,"{""model_type"": ""hist_gradient_boosting""}",PRUNED
12,0.7075329407006096,2026-10-05 10:48:56.392108,2026-10-05 10:49:02.701888,0 days 00:00:06.309780,balanced,0.00866904026900546,0.04429468548382645,500.0,71.0,57.0,hist_gradient_boosting,,,,,,,,,"{""model_type"": ""hist_gradient_boosting""}",PRUNED
13,0.7392037847438345,2026-10-05 10:49:02.702913,2026-10-05 10:49:07.854308,0 days 00:00:05.151395,,8.047799930824626,0.1941880551163163,400.0,124.0,48.0,hist_gradient_boosting,,,,,,,,,"{""model_type"": ""hist_gradient_boosting""}",PRUNED
14,0.7264044336338799,2026-10-05 10:49:07.855318,2026-10-05 10:49:15.502324,0 days 00:00:07.647006,,,,,,,random_forest,,40.0,0.3,5.0,2.0,300.0,,,"{""model_type"": ""random_forest""}",PRUNED
15,0.7403975548898849,2026-10-05 10:49:15.503340,2026-10-05 10:49:34.230077,0 days 00:00:18.726737,,0.008098067625948327,0.04357105487929955,800.0,67.0,10.0,hist_gradient_boosting,,,,,,,0.8582373663722689,,"{""model_type"": ""hist_gradient_boosting""}",COMPLETE
16,0.6995136560340467,2026-10-05 10:49:34.231070,2026-10-05 10:49:40.983310,0 days 00:00:06.752240,balanced,0.005291052854064754,0.03937962680780783,400.0,100.0,100.0,hist_gradient_boosting,,,,,,,,,"{""model_type"": ""hist_gradient_boosting""}",PRUNED
17,0.7403568430376741,2026-10-05 10:49:40.984324,2026-10-05 10:50:35.467515,0 days 00:00:54.483191,,,,,,,random_forest,,24.0,0.5,1.0,4.0,400.0,0.8562226360811396,,"{""model_type"": ""random_forest""}",COMPLETE
18,0.7386880416725238,2026-10-05 10:50:35.468606,2026-10-05 10:50:43.401917,0 days 00:00:07.933311,,0.2961720138882343,0.19084311443418944,600.0,47.0,75.0,hist_gradient_boosting,,,,,,,0.8550626457829499,,"{""model_type"": ""hist_gradient_boosting""}",COMPLETE
19,0.727923547346589,2026-10-05 10:50:43.402973,2026-10-05 10:50:49.747525,0 days 00:00:06.344552,,,,,,,random_forest,balanced,40.0,0.3,4.0,7.0,300.0,,,"{""model_type"": ""random_forest""}",PRUNED
20,0.7187854262498662,2026-10-05 10:50:49.748488,2026-10-05 10:50:55.436802,0 days 00:00:05.688314,,,,,,,random_forest,,16.0,sqrt,1.0,4.0,500.0,,,"{""model_type"": ""random_forest""}",PRUNED
21,0.7417624790570976,2026-10-05 10:50:55.437819,2026-10-05 10:51:21.815632,0 days 00:00:26.377813,,0.0026547133738465726,0.03810319957788459,800.0,68.0,10.0,hist_gradient_boosting,,,,,,,0.8586647363687385,,"{""model_type"": ""hist_gradient_boosting""}",COMPLETE
22,0.7418386432180107,2026-10-05 10:51:21.816717,2026-10-05 10:51:58.598599,0 days 00:00:36.781882,,0.0010937644796687805,0.03094398621303803,700.0,95.0,11.0,hist_gradient_boosting,,,,,,,0.8583289163035478,,"{""model_type"": ""hist_gradient_boosting""}",COMPLETE
23,0.7408838649350339,2026-10-05 10:51:58.599799,2026-10-05 10:52:11.266948,0 days 00:00:12.667149,,0.0013185500178575847,0.03342136180561414,700.0,98.0,14.0,hist_gradient_boosting,,,,,,,,,"{""model_type"": ""hist_gradient_boosting""}",PRUNED
24,0.7405611587345561,2026-10-05 10:52:11.267971,2026-10-05 10:52:26.550397,0 days 00:00:15.282426,,0.0008468714567652839,0.030574249505310166,800.0,98.0,32.0,hist_gradient_boosting,,,,,,,,,"{""model_type"": ""hist_gradient_boosting""}",PRUNED
25,0.7427031144245954,2026-10-05 10:52:26.551377,2026-10-05 10:52:49.625262,0 days 00:00:23.073885,,0.001145329377403988,0.05935264821497161,700.0,81.0,36.0,hist_gradient_boosting,,,,,,,0.8580236911585937,,"{""model_type"": ""hist_gradient_boosting""}",COMPLETE
26,0.7416398445235832,2026-10-05 10:52:49.626302,2026-10-05 10:53:07.476181,0 days 00:00:17.849879,,0.0004626486621764697,0.06258105324721543,600.0,85.0,39.0,hist_gradient_boosting,,,,,,,0.857779530052632,,"{""model_type"": ""hist_gradient_boosting""}",COMPLETE
27,0.7388670820492976,2026-10-05 10:53:07.476950,2026-10-05 10:53:14.641615,0 days 00:00:07.164665,,0.00011486270616609161,0.059878293472222996,400.0,110.0,41.0,hist_gradient_boosting,,,,,,,,,"{""model_type"": ""hist_gradient_boosting""}",PRUNED
28,0.7393506792758134,2026-10-05 10:53:14.642661,2026-10-05 10:53:28.188741,0 days 00:00:13.546080,,0.034816306753097936,0.026378669724865134,700.0,86.0,24.0,hist_gradient_boosting,,,,,,,,,"{""model_type"": ""hist_gradient_boosting""}",PRUNED
29,0.714289356516371,2026-10-05 10:53:28.189979,2026-10-05 10:53:36.212808,0 days 00:00:08.022829,balanced,0.0007150601784989662,0.05295990121282703,300.0,110.0,53.0,hist_gradient_boosting,,,,,,,,,"{""model_type"": ""hist_gradient_boosting""}",PRUNED
30,0.7430842909603642,2026-10-05 10:53:36.213740,2026-10-05 10:53:49.488191,0 days 00:00:13.274451,,0.002598010746727576,0.09011863543751047,700.0,57.0,32.0,hist_gradient_boosting,,,,,,,0.8575047069323102,,"{""model_type"": ""hist_gradient_boosting""}",COMPLETE
31,0.74301625826073,2026-10-05 10:53:49.489273,2026-10-05 10:54:03.959713,0 days 00:00:14.470440,,0.001792514497768384,0.09251339635651439,700.0,54.0,34.0,hist_gradient_boosting,,,,,,,0.8580541910288225,,"{""model_type"": ""hist_gradient_boosting""}",COMPLETE
32,0.7377888456288636,2026-10-05 10:54:03.960852,2026-10-05 10:54:09.062061,0 days 00:00:05.101209,,0.0032756690874027328,0.10575599650820983,700.0,52.0,35.0,hist_gradient_boosting,,,,,,,,,"{""model_type"": ""hist_gradient_boosting""}",PRUNED
33,0.7436758364756586,2026-10-05 10:54:09.063193,2026-10-05 10:54:24.310114,0 days 00:00:15.246921,,0.019299482779850757,0.10310061570109573,500.0,46.0,31.0,hist_gradient_boosting,,,,,,,0.8583594748811344,,"{""model_type"": ""hist_gradient_boosting""}",COMPLETE
34,0.7397420341894628,2026-10-05 10:54:24.311104,2026-10-05 10:54:28.412770,0 days 00:00:04.101666,,0.025586748990010403,0.10911042844734571,500.0,49.0,27.0,hist_gradient_boosting,,,,,,,,,"{""model_type"": ""hist_gradient_boosting""}",PRUNED
35,0.7306800820465041,2026-10-05 10:54:28.413774,2026-10-05 10:54:31.559614,0 days 00:00:03.145840,,0.019238978222074415,0.13598270200535958,500.0,37.0,47.0,hist_gradient_boosting,,,,,,,,,"{""model_type"": ""hist_gradient_boosting""}",PRUNED
36,0.7444549924925131,2026-10-05 10:54:31.560706,2026-10-05 10:54:43.468021,0 days 00:00:11.907315,,0.06416399186051586,0.07859132916582494,300.0,58.0,31.0,hist_gradient_boosting,,,,,,,0.8593363345652932,,"{""model_type"": ""hist_gradient_boosting""}",COMPLETE
37,0.7406868040134027,2026-10-05 10:54:43.469048,2026-10-05 10:54:59.491176,0 days 00:00:16.022128,,0.08425016396974416,0.08395072691896048,300.0,58.0,18.0,hist_gradient_boosting,,,,,,,0.8579320573596606,,"{""model_type"": ""hist_gradient_boosting""}",COMPLETE
38,0.7012715258430046,2026-10-05 10:54:59.492199,2026-10-05 10:55:05.373986,0 days 00:00:05.881787,balanced,0.44296780513133627,0.08546369567148118,600.0,39.0,46.0,hist_gradient_boosting,,,,,,,,,"{""model_type"": ""hist_gradient_boosting""}",PRUNED
39,0.7423658093152615,2026-10-05 10:55:05.375031,2026-10-05 10:55:09.612925,0 days 00:00:04.237894,,0.051298168663501724,0.14259187509960078,300.0,59.0,20.0,hist_gradient_boosting,,,,,,,,,"{""model_type"": ""hist_gradient_boosting""}",PRUNED
